<?xml version="1.0" encoding="UTF-8"?>
<!-- edited with XML Spy v4.4 U (http://www.xmlspy.com) by name (company) -->
<Command Name="GetLOCDataByMsisdn" xmlns:xsi="http://www.w3.org/2001/XMLSchema-instance" xsi:noNamespaceSchemaLocation="Command.xsd">
	<Description>Запрос локации абонента</Description>
	<Author Name="Timur Khamzin" Date="2015-11-16+15:00"/>
	<Request Template='Qry User:MSISDN={0},Item=LOC;^M'>
		<Item Name="msisdn" Type="Wellknown"/>
	</Request>
	<ErrorsList CodePage="windows-1251">
		<Error Name="ERR3001" Value="NoSuchObjectInstance"/>
		<Error Name="" Value="SUCCESS"/>
	</ErrorsList>
</Command>
