<?xml version="1.0" encoding="UTF-8"?>
<Command Name="Unsubscribe" xmlns:xsi="http://www.w3.org/2001/XMLSchema-instance" xsi:noNamespaceSchemaLocation="Command.xsd">
	<Description>Удаление профиля</Description>
	<Author Name="YAI" Date="2015-04-08+10:36"/>
	<Request Template="?msisdn={0}">
		<Item Name="msisdn" Type="Wellknown"/>
	</Request>
	<ErrorsList CodePage="ASCII">
		<Error Name=" 200 OK" Value="SUCCESS"/>
		<Error Name="500" Value="FAILURE"/>
	</ErrorsList>
</Command>
