<?xml version="1.0" encoding="UTF-8"?>
<Command Name="BlockFamilyHereLBS" xmlns:xsi="http://www.w3.org/2001/XMLSchema-instance" xsi:noNamespaceSchemaLocation="Command.xsd">
	<Description>BlockFamilyHereLBS</Description>
	<Author Name="NNM" Date="2020-01-10+10:55"/>
	<Request Template="msisdn={0}&#38;servicecode=FR17276">
	<Item Name="msisdn" Type="Wellknown" />
	</Request>
	<ErrorsList CodePage="ASCII">
		<Error Name="&#34;result&#34;:0" Value="SUCCESS"/>
		<Error Name="&#34;result&#34;:1" Value="SUCCESS"/>
		<Error Name="&#34;result&#34;:-1" Value="MsisdnNotDefined"/>
	</ErrorsList>
</Command>
