<?xml version="1.0" encoding="UTF-8"?>
<Command Name="DeleteSubscriberonVD" xmlns:xsi="http://www.w3.org/2001/XMLSchema-instance" xsi:noNamespaceSchemaLocation="Command.xsd">
	<Description>DeleteSubscriber</Description>
	<Author Name="YAI" Date="2013-04-15+10:50"/>
	<Request Template="userdelete.php?blogin=MTSby_bill_login&amp;bpsw=EcRd3wHOvGhZa_k&amp;ulogin={0}&amp;xml=1">
	<Item Name="msisdn" Type="Wellknown" />
	</Request>
	<ErrorsList CodePage="ASCII">
		<Error Name="&lt;RESULT&gt;1&lt;/RESULT&gt;" Value="SUCCESS"/>
		<Error Name="&lt;RESULT&gt;0&lt;/RESULT&gt;" Value="SUCCESS"/>
	</ErrorsList>
</Command>
