<?xml version="1.0" encoding="UTF-8"?>
<Command Name="GetHistoryOnEIR" xmlns:xsi="http://www.w3.org/2001/XMLSchema-instance" xsi:noNamespaceSchemaLocation="Command.xsd">
	<Description>Получение истории</Description>
	<Author Name="Timur Khamzin" Date="2019-04-04+05:00"/>
	<Request Template="cmd=gethistory&amp;imsi={1}&amp;msisdn={0}&amp;pastdays={2}">
		<Item Name="msisdn" Type="Wellknown"/>
		<Item Name="imsi" Type="Wellknown"/>
                <Item Name="pastdays" Type="Parameter"/>
	</Request>                                                                                            
	<ErrorsList CodePage="ASCII"/>
</Command>
