<?xml version="1.0" encoding="UTF-8"?>
<Command Name="DeleteSubscriber2IMSI" xmlns:xsi="http://www.w3.org/2001/XMLSchema-instance" xsi:noNamespaceSchemaLocation="Command.xsd">
	<Description>Удаление абонента 2 IMSI</Description>
	<Author Name="Timur Khamzin" Date="2014-12-23+15:00"/>
	<Request Template='RMV SUB:IMSI="{0}";'>
		<Item Name="imsi" Type="Wellknown"/>
	</Request>
	<ErrorsList CodePage="windows-1251">
		<Error Name="ERR3007" Value="SUCCESS"/>
		<Error Name="ERR3001" Value="SUCCESS"/>
       	</ErrorsList>
</Command>
